{
  "id": "tourism-hotel",
  "industry": "旅游酒店",
  "category": "mixed",
  "asOf": "2026-08-10",
  "updatedAt": "2026-08-11T19:20:00+08:00",
  "decisionOverview": {
    "items": [
      {
        "label": "产业价值",
        "value": "中高",
        "score": 74,
        "comment": "休闲需求、银发与入境游长期扩容"
      },
      {
        "label": "商业质量",
        "value": "分化",
        "score": 66,
        "comment": "酒店加盟优于重资产，优质景区有稀缺性"
      },
      {
        "label": "估值吸引力",
        "value": "中",
        "score": 62,
        "comment": "部分修复已定价，盈利持续性待验证"
      },
      {
        "label": "景气位置",
        "value": "温和扩张",
        "score": 68,
        "comment": "人次增长快于花费，结构性复苏"
      },
      {
        "label": "综合评级",
        "value": "观察",
        "score": 65,
        "comment": "酒店改善领先，板块尚未全面共振"
      }
    ],
    "coreConflict": "旅游人次与入境客流增长明确，但人均花费承压、酒店供给扩张和免税/演艺利润恢复不一致，客流尚未充分转化为上市公司盈利。",
    "action": "当前观察，不追逐假期客流主题；优先研究RevPAR转正、加盟占比高、现金流改善的酒店龙头，以及客流和客单价同步增长的稀缺景区。"
  },
  "weeklyChanges": {
    "period": "首次建立",
    "title": "首次建立旅游酒店决策基线",
    "summary": "本期首次建立结构化基线。下周将比较出游人次、人均花费、酒店RevPAR、入境客流、公司盈利与技术触发状态。",
    "items": []
  },
  "prosperity": {
    "level": "中高景气",
    "direction": "温和扩张、利润分化",
    "directionTone": "positive",
    "score": 68,
    "verdict": "2026Q1国内出游19.01亿人次、同比+6.0%，旅游花费1.86万亿元、同比+2.9%，显示需求扩张但人均花费下降。五一与端午延续“人次增速略高于花费”；入境外国人上半年同比+20.4%形成结构增量。酒店端首旅Q1 RevPAR同比+1.7%已转正，但演艺、免税和部分景区盈利仍分化，行业景气不能直接映射为板块普涨。",
    "dimensions": [
      {
        "name": "国内客流",
        "value": "较强",
        "change": "Q1人次同比+6.0%",
        "tone": "positive"
      },
      {
        "name": "人均消费",
        "value": "偏弱",
        "change": "花费增速低于人次",
        "tone": "warning"
      },
      {
        "name": "酒店经营",
        "value": "改善",
        "change": "首旅RevPAR+1.7%",
        "tone": "positive"
      },
      {
        "name": "入境游",
        "value": "高增长",
        "change": "外国人入境+20.4%",
        "tone": "positive"
      }
    ],
    "driver": "休闲化、亲子与银发、演唱会赛事、免签入境和高铁航空网络共同拉动客流；盈利取决于客单价、供给增速和经营杠杆。",
    "improvement": "国内旅游花费增速连续两个季度高于人次，酒店RevPAR普遍转正，景区客单价与免税毛利率同步改善。",
    "deterioration": "客流仍增但人均消费继续下降、酒店供给快于需求、极端天气或入境政策边际收紧。"
  },
  "summary": {
    "stage": "需求扩张—盈利修复分化",
    "rating": "观察；酒店龙头领先于板块",
    "confidence": "中高",
    "conclusion": "旅游酒店具备中长期投资价值，但当前应做结构选择而非板块追涨。需求端真实增长，入境游更强；酒店加盟模式和稀缺景区的经营质量相对更好，但人均花费偏弱，宋城演艺2025收入同比-6.61%，中免毛利率承压，说明利润复苏并不普遍。8股等权篮子为77.01，MA20/60/145为74.08/74.73/85.88，技术评级“观察”。等待放量突破83.03并由中报盈利确认后再考虑试仓。",
    "evidence": [
      "2026Q1国内出游19.01亿人次同比+6.0%，花费1.86万亿元同比+2.9%",
      "2026H1外国人入境2291万人次同比+20.4%，免签入境同比+30.6%",
      "首旅酒店2026Q1 RevPAR 143元同比+1.7%，酒店经营出现局部反转"
    ]
  },
  "cycle": {
    "current": "需求扩张—盈利修复分化",
    "stages": [
      "疫情出清",
      "需求快速恢复",
      "供给扩张",
      "价格与利润承压",
      "需求扩张—盈利修复分化",
      "RevPAR与客单共振",
      "景气扩张"
    ]
  },
  "reversalConditions": [
    {
      "name": "国内旅游需求持续增长",
      "dimension": "需求",
      "current": "2026Q1人次+6.0%，五一+3.6%，端午+4.4%",
      "threshold": "连续两个季度/假期人次保持正增长",
      "status": "met",
      "trend": "up",
      "source": "文化和旅游部，2026Q1及假期数据"
    },
    {
      "name": "人均旅游消费改善",
      "dimension": "价格",
      "current": "Q1花费+2.9%低于人次+6.0%",
      "threshold": "花费增速连续两个季度高于人次增速",
      "status": "unmet",
      "trend": "down",
      "source": "文化和旅游部，2026Q1"
    },
    {
      "name": "酒店RevPAR普遍转正",
      "dimension": "酒店盈利",
      "current": "首旅Q1 RevPAR+1.7%，行业公司仍分化",
      "threshold": "核心酒店集团连续两季RevPAR正增长",
      "status": "partial",
      "trend": "up",
      "source": "首旅、锦江2026Q1报告"
    },
    {
      "name": "入境游高增长",
      "dimension": "结构需求",
      "current": "H1外国人入境2291万人次，同比+20.4%",
      "threshold": "外国人入境维持双位数增长",
      "status": "met",
      "trend": "up",
      "source": "国家移民管理局，2026H1"
    },
    {
      "name": "上市公司利润扩散",
      "dimension": "盈利",
      "current": "酒店改善，演艺、免税与景区表现分化",
      "threshold": "多数样本利润和经营现金流同步增长",
      "status": "partial",
      "trend": "flat",
      "source": "2025年报与2026Q1财报"
    },
    {
      "name": "技术趋势确认",
      "dimension": "市场定价",
      "current": "篮子77.01，MA20/60/145=74.08/74.73/85.88",
      "threshold": "放量突破83.03并回踩不破",
      "status": "partial",
      "trend": "up",
      "source": "腾讯证券前复权行情，截至2026-08-10"
    }
  ],
  "metrics": [
    {
      "label": "Q1国内出游",
      "value": "19.01",
      "unit": "亿人次",
      "change": "同比 +6.0%",
      "direction": "up",
      "series": [
        14.19,
        17.94,
        19.01
      ]
    },
    {
      "label": "Q1旅游花费",
      "value": "1.86",
      "unit": "万亿元",
      "change": "同比 +2.9%",
      "direction": "up",
      "series": [
        1.52,
        1.81,
        1.86
      ]
    },
    {
      "label": "五一国内出游",
      "value": "3.25",
      "unit": "亿人次",
      "change": "同比 +3.6%",
      "direction": "up",
      "series": [
        2.95,
        3.14,
        3.25
      ]
    },
    {
      "label": "外国人入境",
      "value": "2,291",
      "unit": "万人次/H1",
      "change": "同比 +20.4%",
      "direction": "up",
      "series": [
        1463,
        1903,
        2291
      ]
    },
    {
      "label": "首旅RevPAR",
      "value": "143",
      "unit": "元/Q1",
      "change": "同比 +1.7%",
      "direction": "up",
      "series": [
        137,
        141,
        143
      ]
    },
    {
      "label": "篮子收盘",
      "value": "77.01",
      "unit": "点",
      "change": "截至8月10日",
      "direction": "up",
      "series": [
        70.51,
        72.86,
        73.73,
        71.86,
        72.4,
        72.64,
        73.27,
        73.37,
        70.63,
        72.95,
        73.74,
        74.82,
        75.32,
        76.4,
        77.29,
        76.06,
        75.79,
        75.41,
        75.51,
        77.01
      ]
    }
  ],
  "industryChain": [
    {
      "stage": "上游",
      "title": "交通、物业、目的地资源与内容IP",
      "items": [
        "航空铁路和道路决定可达性，物业租金影响酒店成本",
        "自然与文化资源稀缺，但受天气、承载量和监管约束",
        "演艺IP、赛事和会展可提高停留时长与二次消费"
      ]
    },
    {
      "stage": "中游",
      "title": "酒店、景区、旅行服务与免税",
      "items": [
        "酒店加盟管理的资本效率通常优于重资产直营",
        "景区利润取决于客流、客单、索道交通与二消",
        "OTA和旅行社掌握流量，免税依赖政策、客流和折扣纪律"
      ]
    },
    {
      "stage": "下游",
      "title": "休闲、商务、入境与银发客群",
      "items": [
        "大众休闲贡献人次，商务出行影响高端酒店房价",
        "亲子、银发、演唱会赛事和冰雪游提供结构增长",
        "入境游客消费能力较强，但支付、语言和产品供给仍需完善"
      ]
    }
  ],
  "companyComparison": [
    {
      "tier": "核心观察",
      "tone": "positive",
      "company": "首旅酒店",
      "ticker": "600258.SH",
      "driver": "RevPAR转正、加盟扩张与效率改善",
      "valuation": "用EBITDA/FCF与加盟收入增长交叉验证",
      "risk": "酒店供给扩张、房价承压"
    },
    {
      "tier": "反转观察",
      "tone": "warning",
      "company": "锦江酒店",
      "ticker": "600754.SH",
      "driver": "境内RevPAR、海外整合与债务优化",
      "valuation": "分部EV/EBITDA并关注净负债",
      "risk": "海外经营、整合和供给竞争"
    },
    {
      "tier": "优质景区",
      "tone": "positive",
      "company": "黄山旅游/峨眉山A",
      "ticker": "600054.SH / 000888.SZ",
      "driver": "资源稀缺、索道与客流恢复",
      "valuation": "正常化客流下的FCF和股息能力",
      "risk": "天气、门票政策和客单价"
    },
    {
      "tier": "成长弹性",
      "tone": "warning",
      "company": "长白山/西域旅游",
      "ticker": "603099.SH / 300859.SZ",
      "driver": "冰雪、区域客流和项目扩容",
      "valuation": "高弹性需匹配客流、产能与利润兑现",
      "risk": "季节性、估值波动和承载力"
    },
    {
      "tier": "修复观察",
      "tone": "warning",
      "company": "宋城演艺",
      "ticker": "300144.SZ",
      "driver": "演艺项目、轻资产输出和内容迭代",
      "valuation": "单项目现金流与成熟项目利润率",
      "risk": "2025利润下滑、项目投入和客单价"
    },
    {
      "tier": "修复观察",
      "tone": "negative",
      "company": "中国中免",
      "ticker": "601888.SH",
      "driver": "入境出境客流、海南政策和市内免税",
      "valuation": "关注毛利率、库存和经营现金流，不只看收入",
      "risk": "折扣竞争、毛利率与渠道分流"
    }
  ],
  "valuationScenarios": [
    {
      "name": "乐观",
      "weight": "30%",
      "assumption": "人均花费转正、酒店RevPAR持续增长、入境高增",
      "valuation": "酒店用EV/EBITDA，景区/演艺用FCF，免税看利润率修复",
      "signal": "中报利润和现金流普遍上修"
    },
    {
      "name": "基准",
      "weight": "50%",
      "assumption": "客流温和增长，客单偏弱，细分继续分化",
      "valuation": "以正常化利润估值，不把单个假期客流年化",
      "signal": "酒店领先、景区分化、免税缓慢修复"
    },
    {
      "name": "悲观",
      "weight": "20%",
      "assumption": "人均消费下降、供给过快、天气事件扰动",
      "valuation": "盈利下修，重资产与高估值标的折价",
      "signal": "RevPAR转负且中报现金流恶化"
    }
  ],
  "catalysts": [
    {
      "date": "2026-08至09",
      "event": "暑期数据与上市公司中报",
      "expectation": "RevPAR、客单价和利润改善",
      "status": "pending",
      "statusLabel": "关键验证"
    },
    {
      "date": "2026-10",
      "event": "国庆中秋旺季",
      "expectation": "花费增速追上人次",
      "status": "pending",
      "statusLabel": "核心节点"
    },
    {
      "date": "持续",
      "event": "免签扩围与国际航班恢复",
      "expectation": "入境游客和高客单消费增长",
      "status": "pending",
      "statusLabel": "结构催化"
    }
  ],
  "executionPlan": {
    "action": "观察；酒店龙头和稀缺景区优先",
    "trigger": "20日均量1.2倍以上突破83.03，且中报验证RevPAR/客单价与利润改善",
    "add": "突破后回踩MA60 74.73不破，行业花费增速向人次增速靠拢",
    "priceInvalidation": "篮子跌破69.48",
    "fundamentalInvalidation": "酒店RevPAR重新转负、旅游花费明显弱于人次，或核心公司现金流恶化",
    "nextReview": "2026年中报和暑期经营数据披露后"
  },
  "bearCase": [
    "旅游人次增长可能来自短途和低价出行，无法支持人均消费与利润率",
    "酒店加盟扩张增加房间供给，RevPAR修复可能被供给稀释",
    "入境人数高增长基数较低，且未必直接流向A股景区酒店公司",
    "极端天气、公共安全和宏观消费信心会造成明显季度波动"
  ],
  "evidenceQuality": [
    {
      "grade": "A",
      "label": "旅游、消费与出入境数据",
      "note": "文旅部、国家统计局、国家移民管理局"
    },
    {
      "grade": "A",
      "label": "公司经营与财务",
      "note": "交易所和公司定期报告"
    },
    {
      "grade": "A",
      "label": "行情",
      "note": "腾讯证券前复权日线，8股等权计算"
    },
    {
      "grade": "D",
      "label": "波浪与缠论",
      "note": "主观结构工具，仅辅助择时"
    }
  ],
  "technical": {
    "instrument": "旅游酒店A股8股等权篮子",
    "timeframe": "日线 / 周线",
    "trend": "篮子77.01；MA5/10/20/60/90/120/145/250为75.96/75.73/74.08/74.73/78.86/83.01/85.88/89.05。技术评级：观察。",
    "volume": "当日成交量131.60万手，是5/10/20/60/90/145日均量的1.11/0.99/0.93/0.99/1.03/0.93倍。",
    "wave": "主计数为调整后的修复浪；备选为区间震荡中的反弹。突破83.03提高反转可信度，跌破69.48失效。",